{
  "$schema": "https://json-schema.org/draft/2020-12/schema",
  "$id": "https://github.com/.../normalisering/rules/rules.schema.json",
  "title": "HCA normalization rewrite rule",
  "description": "Canonical, period-aware, provenance-bearing rewrite rule. The same logical record is mirrored in rules.tsv (AWK-friendly) and rules.json (full metadata).",
  "type": "object",
  "required": ["id", "source", "target", "confidence"],
  "additionalProperties": false,
  "properties": {
    "id": {
      "type": "string",
      "pattern": "^R[0-9]{4,}$",
      "description": "Stable rule identifier, cited in normalization provenance and GitHub issues."
    },
    "source": {
      "type": "string",
      "minLength": 1,
      "description": "Literal historical form / substring to match. Leading/trailing spaces are significant."
    },
    "target": {
      "type": "string",
      "description": "Literal modern replacement."
    },
    "confidence": {
      "type": "number",
      "minimum": 0,
      "maximum": 1,
      "description": "Aggregate confidence; 1.0 for hand-curated authoritative rules."
    },
    "evidence": {
      "type": "array",
      "items": {"type": "string"},
      "description": "Provenance: dictionary citations, issue numbers (#143), corpus refs, 'legacy:...'."
    },
    "period": {
      "oneOf": [
        {"type": "null"},
        {
          "type": "object",
          "additionalProperties": false,
          "properties": {
            "from": {"type": ["integer", "string"], "description": "Earliest year the rule applies (inclusive)."},
            "to": {"type": ["integer", "string"], "description": "Latest year the rule applies (inclusive). Use e.g. 1872 to disable a rule after a reform."}
          }
        }
      ],
      "description": "Period of validity. null = all periods."
    },
    "protect_entities": {
      "type": "boolean",
      "default": true,
      "description": "If true, the rule is suppressed inside spans tagged as named entities (persons/places/works)."
    },
    "enabled": {
      "type": "boolean",
      "default": true,
      "description": "Disabled rules are kept for provenance but not applied (mirrors the 7th TSV column)."
    }
  }
}
