[
  {
    "id": "R0001",
    "source": "ct",
    "target": "kt",
    "confidence": 1.0,
    "evidence": [
      "legacy:DSL-HCAC_replaceOriginal2ModernXSLT3.0.xsl"
    ],
    "period": null,
    "protect_entities": true,
    "enabled": true
  },
  {
    "id": "R0002",
    "source": "Meen",
    "target": "mén",
    "confidence": 1.0,
    "evidence": [
      "legacy:DSL-HCAC_replaceOriginal2ModernXSLT3.0.xsl"
    ],
    "period": null,
    "protect_entities": true,
    "enabled": true
  },
  {
    "id": "R0003",
    "source": "Maneer",
    "target": "manér",
    "confidence": 1.0,
    "evidence": [
      "legacy:DSL-HCAC_replaceOriginal2ModernXSLT3.0.xsl"
    ],
    "period": null,
    "protect_entities": true,
    "enabled": true
  },
  {
    "id": "R0004",
    "source": "Thee",
    "target": "te",
    "confidence": 1.0,
    "evidence": [
      "legacy:DSL-HCAC_replaceOriginal2ModernXSLT3.0.xsl"
    ],
    "period": null,
    "protect_entities": true,
    "enabled": true
  },
  {
    "id": "R0005",
    "source": "Reelingen",
    "target": "rælingen",
    "confidence": 1.0,
    "evidence": [
      "legacy:DSL-HCAC_replaceOriginal2ModernXSLT3.0.xsl"
    ],
    "period": null,
    "protect_entities": true,
    "enabled": true
  },
  {
    "id": "R0006",
    "source": "leet",
    "target": "leeet",
    "confidence": 1.0,
    "evidence": [
      "legacy:DSL-HCAC_replaceOriginal2ModernXSLT3.0.xsl"
    ],
    "period": null,
    "protect_entities": true,
    "enabled": true
  },
  {
    "id": "R0007",
    "source": "leende",
    "target": "leeende",
    "confidence": 1.0,
    "evidence": [
      "legacy:DSL-HCAC_replaceOriginal2ModernXSLT3.0.xsl"
    ],
    "period": null,
    "protect_entities": true,
    "enabled": true
  },
  {
    "id": "R0008",
    "source": "Ideen",
    "target": "ideeen",
    "confidence": 1.0,
    "evidence": [
      "legacy:DSL-HCAC_replaceOriginal2ModernXSLT3.0.xsl"
    ],
    "period": null,
    "protect_entities": true,
    "enabled": true
  },
  {
    "id": "R0009",
    "source": " Fee",
    "target": " Feee",
    "confidence": 1.0,
    "evidence": [
      "legacy:DSL-HCAC_replaceOriginal2ModernXSLT3.0.xsl"
    ],
    "period": null,
    "protect_entities": true,
    "enabled": true
  },
  {
    "id": "R0010",
    "source": " Feen",
    "target": " Feeen",
    "confidence": 1.0,
    "evidence": [
      "legacy:DSL-HCAC_replaceOriginal2ModernXSLT3.0.xsl"
    ],
    "period": null,
    "protect_entities": true,
    "enabled": true
  },
  {
    "id": "R0011",
    "source": "Seer",
    "target": "Seeer",
    "confidence": 1.0,
    "evidence": [
      "legacy:DSL-HCAC_replaceOriginal2ModernXSLT3.0.xsl"
    ],
    "period": null,
    "protect_entities": true,
    "enabled": true
  },
  {
    "id": "R0012",
    "source": "besneede",
    "target": "tilsneeede",
    "confidence": 1.0,
    "evidence": [
      "legacy:DSL-HCAC_replaceOriginal2ModernXSLT3.0.xsl"
    ],
    "period": null,
    "protect_entities": true,
    "enabled": true
  },
  {
    "id": "R0013",
    "source": "Sneen",
    "target": "sneeen",
    "confidence": 1.0,
    "evidence": [
      "legacy:DSL-HCAC_replaceOriginal2ModernXSLT3.0.xsl"
    ],
    "period": null,
    "protect_entities": true,
    "enabled": true
  },
  {
    "id": "R0014",
    "source": "Beeren",
    "target": "Beeeren",
    "confidence": 1.0,
    "evidence": [
      "legacy:DSL-HCAC_replaceOriginal2ModernXSLT3.0.xsl"
    ],
    "period": null,
    "protect_entities": true,
    "enabled": true
  },
  {
    "id": "R0015",
    "source": "Hveen",
    "target": "Hven",
    "confidence": 1.0,
    "evidence": [
      "legacy:DSL-HCAC_replaceOriginal2ModernXSLT3.0.xsl"
    ],
    "period": null,
    "protect_entities": true,
    "enabled": true
  },
  {
    "id": "R0016",
    "source": "Kaffeen",
    "target": "caféen",
    "confidence": 1.0,
    "evidence": [
      "legacy:DSL-HCAC_replaceOriginal2ModernXSLT3.0.xsl"
    ],
    "period": null,
    "protect_entities": true,
    "enabled": true
  },
  {
    "id": "R0017",
    "source": "Cafeer",
    "target": "caféer",
    "confidence": 1.0,
    "evidence": [
      "legacy:DSL-HCAC_replaceOriginal2ModernXSLT3.0.xsl"
    ],
    "period": null,
    "protect_entities": true,
    "enabled": true
  },
  {
    "id": "R0018",
    "source": "Alleer",
    "target": "alléer",
    "confidence": 1.0,
    "evidence": [
      "legacy:DSL-HCAC_replaceOriginal2ModernXSLT3.0.xsl"
    ],
    "period": null,
    "protect_entities": true,
    "enabled": true
  },
  {
    "id": "R0019",
    "source": "Alleen",
    "target": "alléen",
    "confidence": 1.0,
    "evidence": [
      "legacy:DSL-HCAC_replaceOriginal2ModernXSLT3.0.xsl"
    ],
    "period": null,
    "protect_entities": true,
    "enabled": true
  },
  {
    "id": "R0020",
    "source": "Allee ",
    "target": "allé ",
    "confidence": 1.0,
    "evidence": [
      "legacy:DSL-HCAC_replaceOriginal2ModernXSLT3.0.xsl"
    ],
    "period": null,
    "protect_entities": true,
    "enabled": true
  },
  {
    "id": "R0021",
    "source": "desmeer",
    "target": "desmere",
    "confidence": 1.0,
    "evidence": [
      "legacy:DSL-HCAC_replaceOriginal2ModernXSLT3.0.xsl"
    ],
    "period": null,
    "protect_entities": true,
    "enabled": true
  },
  {
    "id": "R0022",
    "source": "Fricasee",
    "target": "frikassé",
    "confidence": 1.0,
    "evidence": [
      "legacy:DSL-HCAC_replaceOriginal2ModernXSLT3.0.xsl"
    ],
    "period": null,
    "protect_entities": true,
    "enabled": true
  },
  {
    "id": "R0023",
    "source": " reele",
    "target": " reeele",
    "confidence": 1.0,
    "evidence": [
      "legacy:DSL-HCAC_replaceOriginal2ModernXSLT3.0.xsl"
    ],
    "period": null,
    "protect_entities": true,
    "enabled": true
  },
  {
    "id": "R0024",
    "source": "Reele",
    "target": "Reeele",
    "confidence": 1.0,
    "evidence": [
      "legacy:DSL-HCAC_replaceOriginal2ModernXSLT3.0.xsl"
    ],
    "period": null,
    "protect_entities": true,
    "enabled": true
  },
  {
    "id": "R0025",
    "source": " Udseende",
    "target": " udseeende",
    "confidence": 1.0,
    "evidence": [
      "legacy:DSL-HCAC_replaceOriginal2ModernXSLT3.0.xsl"
    ],
    "period": null,
    "protect_entities": true,
    "enabled": true
  },
  {
    "id": "R0026",
    "source": " Forseelse",
    "target": " forseeelse",
    "confidence": 1.0,
    "evidence": [
      "legacy:DSL-HCAC_replaceOriginal2ModernXSLT3.0.xsl"
    ],
    "period": null,
    "protect_entities": true,
    "enabled": true
  },
  {
    "id": "R0027",
    "source": "ee",
    "target": "e",
    "confidence": 1.0,
    "evidence": [
      "legacy:DSL-HCAC_replaceOriginal2ModernXSLT3.0.xsl"
    ],
    "period": null,
    "protect_entities": true,
    "enabled": true
  },
  {
    "id": "R0028",
    "source": "kie",
    "target": "ke",
    "confidence": 1.0,
    "evidence": [
      "legacy:DSL-HCAC_replaceOriginal2ModernXSLT3.0.xsl"
    ],
    "period": null,
    "protect_entities": true,
    "enabled": true
  },
  {
    "id": "R0029",
    "source": "oug",
    "target": "ov",
    "confidence": 1.0,
    "evidence": [
      "legacy:DSL-HCAC_replaceOriginal2ModernXSLT3.0.xsl"
    ],
    "period": null,
    "protect_entities": true,
    "enabled": true
  },
  {
    "id": "R0030",
    "source": "Ph",
    "target": "F",
    "confidence": 1.0,
    "evidence": [
      "legacy:DSL-HCAC_replaceOriginal2ModernXSLT3.0.xsl"
    ],
    "period": null,
    "protect_entities": true,
    "enabled": true
  },
  {
    "id": "R0031",
    "source": "raph",
    "target": "raf",
    "confidence": 1.0,
    "evidence": [
      "legacy:DSL-HCAC_replaceOriginal2ModernXSLT3.0.xsl"
    ],
    "period": null,
    "protect_entities": true,
    "enabled": true
  },
  {
    "id": "R0032",
    "source": "soph",
    "target": "sof",
    "confidence": 1.0,
    "evidence": [
      "legacy:DSL-HCAC_replaceOriginal2ModernXSLT3.0.xsl"
    ],
    "period": null,
    "protect_entities": true,
    "enabled": true
  },
  {
    "id": "R0064",
    "source": "aaer",
    "target": "år",
    "confidence": 0.95,
    "evidence": [
      "golden-standard:-aaer contraction",
      "RetogSkrift:Bind2"
    ],
    "period": null,
    "protect_entities": true,
    "enabled": true
  },
  {
    "id": "R0033",
    "source": "aa",
    "target": "å",
    "confidence": 1.0,
    "evidence": [
      "legacy:DSL-HCAC_replaceOriginal2ModernXSLT3.0.xsl"
    ],
    "period": null,
    "protect_entities": true,
    "enabled": true
  },
  {
    "id": "R0034",
    "source": "Aa",
    "target": "Å",
    "confidence": 1.0,
    "evidence": [
      "legacy:DSL-HCAC_replaceOriginal2ModernXSLT3.0.xsl"
    ],
    "period": null,
    "protect_entities": true,
    "enabled": true
  },
  {
    "id": "R0035",
    "source": " eet",
    "target": " ét",
    "confidence": 1.0,
    "evidence": [
      "legacy:DSL-HCAC_replaceOriginal2ModernXSLT3.0.xsl"
    ],
    "period": null,
    "protect_entities": true,
    "enabled": true
  },
  {
    "id": "R0036",
    "source": "ö",
    "target": "ø",
    "confidence": 1.0,
    "evidence": [
      "legacy:DSL-HCAC_replaceOriginal2ModernXSLT3.0.xsl"
    ],
    "period": null,
    "protect_entities": true,
    "enabled": true
  },
  {
    "id": "R0037",
    "source": "muel",
    "target": "mul",
    "confidence": 1.0,
    "evidence": [
      "legacy:DSL-HCAC_replaceOriginal2ModernXSLT3.0.xsl"
    ],
    "period": null,
    "protect_entities": true,
    "enabled": true
  },
  {
    "id": "R0038",
    "source": "foer",
    "target": "for",
    "confidence": 1.0,
    "evidence": [
      "legacy:DSL-HCAC_replaceOriginal2ModernXSLT3.0.xsl"
    ],
    "period": null,
    "protect_entities": true,
    "enabled": true
  },
  {
    "id": "R0039",
    "source": "Roes",
    "target": "ros",
    "confidence": 1.0,
    "evidence": [
      "legacy:DSL-HCAC_replaceOriginal2ModernXSLT3.0.xsl"
    ],
    "period": null,
    "protect_entities": true,
    "enabled": true
  },